{
  "schemaVersion": "1.0.0",
  "transactionId": "0198e0a1-0000-7021-8021-000000000021",
  "commandId": "0198e0a1-0000-7001-8001-000000000001",
  "idempotencyKey": "p2-result-journal-schedule-fixture",
  "effectScope": "WorkflowRun:0198e0a1-0000-7002-8002-000000000002",
  "payloadHash": "6e8f4ab35aae9aceaaa81e8fa42b6ae169cacf1dd18c577c1f6627ce8b540935",
  "stream": {
    "aggregateType": "WorkflowRun",
    "aggregateId": "0198e0a1-0000-7002-8002-000000000002",
    "expectedVersion": 0
  },
  "events": [
    {
      "schemaVersion": "1.0.0",
      "eventId": "0198e0a1-0000-7004-8004-000000000004",
      "eventType": "WorkflowRunCreated",
      "aggregateType": "WorkflowRun",
      "aggregateId": "0198e0a1-0000-7002-8002-000000000002",
      "aggregateVersion": 1,
      "occurredAt": "2026-08-26T08:10:00Z",
      "actor": {
        "actorType": "SYSTEM",
        "actorId": "kernel",
        "actorVersion": "0.1.0"
      },
      "causationId": "0198e0a1-0000-7001-8001-000000000001",
      "correlationId": "0198e0a1-0000-7003-8003-000000000003",
      "payloadSchema": {
        "schemaId": "urn:aseos:schema:workflow-run-created-payload:1.0.0",
        "schemaVersion": "1.0.0",
        "schemaHash": "bb8c6e1011b888de71ae06824f6438de3e51a825883f4080ad309f04a6e75db2"
      },
      "payloadHash": "c63d352a147663b11dde8422543527f32d45dc37f4b67893f8faca7270dcd1e5",
      "payload": {
        "workflowDefinitionId": "fixture-change-workflow",
        "workflowDefinitionVersion": "1.0.0",
        "createdByCommandId": "0198e0a1-0000-7001-8001-000000000001"
      }
    }
  ],
  "outbox": [
    {
      "schemaVersion": "1.0.0",
      "taskId": "0198e0a1-0000-7005-8005-000000000005",
      "executionId": "0198e0a1-0000-7006-8006-000000000006",
      "attempt": 1,
      "correlationId": "0198e0a1-0000-7003-8003-000000000003",
      "causationId": "0198e0a1-0000-7004-8004-000000000004",
      "idempotencyKey": "apply-change:fixture:execution-001",
      "effectScope": "workspace:fixture-change-workflow:target.txt",
      "capability": "write_workspace",
      "permissionSet": [
        "workspace.read:fixture",
        "workspace.write:fixture/target.txt"
      ],
      "requiredIsolationLevel": "PROCESS_RESTRICTED",
      "inputArtifactRefs": [
        {
          "artifactId": "0198e0a1-0000-7102-8002-000000000102",
          "sha256": "e666c1bc66aeb99394add94c88cd6ea7559e4f44deee1b6392ae7fad573b9ddb",
          "mediaType": "text/plain",
          "sizeBytes": 17,
          "sensitivity": "INTERNAL",
          "logicalName": "desired-content.txt"
        }
      ],
      "timeoutMs": 30000,
      "resourceBudget": {
        "maxCpuTimeMs": 10000,
        "maxMemoryBytes": 134217728,
        "maxProcessCount": 4,
        "maxOutputBytes": 1048576,
        "networkMode": "DENY"
      },
      "adapterContractVersion": "1.0.0",
      "payloadSchema": {
        "schemaId": "urn:aseos:schema:apply-workspace-change-payload:1.0.0",
        "schemaVersion": "1.0.0",
        "schemaHash": "88ce6660b2956f94ba7244fd7688bca5f57a408ff63b278c233fed7c2993a433"
      },
      "payloadHash": "4f55e2f8f628ce62e44d4ba2ebb749d3d86c09c55676bf89b90cc7bc9db4c1c3",
      "payload": {
        "workspaceRef": "fixture-workspace",
        "baseSnapshotHash": "9220e38f08d4e4102e5f174940b4f6b234e27bcff47fc00257599779ef85ce03",
        "targetPath": "target.txt",
        "desiredContentArtifactRef": {
          "artifactId": "0198e0a1-0000-7102-8002-000000000102",
          "sha256": "e666c1bc66aeb99394add94c88cd6ea7559e4f44deee1b6392ae7fad573b9ddb",
          "mediaType": "text/plain",
          "sizeBytes": 17,
          "sensitivity": "INTERNAL",
          "logicalName": "desired-content.txt"
        }
      }
    }
  ],
  "audit": [
    {
      "auditId": "0198e0a1-0000-7022-8022-000000000022",
      "occurredAt": "2026-08-26T08:10:00Z",
      "action": "SIDE_EFFECT_SCHEDULED",
      "payloadHash": "7b32099fba0d16fc571602fe9474fc7c6e4d54694f6ca8d34e59998301a223b5"
    }
  ],
  "capturedAt": "2026-08-26T08:10:00Z"
}
